ef306c2a,Victor Grechi,2024-11,PO-2127: integrating with backend service.
f301e17f,Victor Grechi,2024-11,PO-2127: implementing mocked question and notices list.
5f3ac506,Carlos Henrique,2024-11,REEN(456): Adicionado os serviços para os usuários habilitados
c0de56f5,mathmartins-sb,2024-11,fix(i18n): correct Portuguese translation for offers by group
29b3a18f,mathmartins-sb,2024-11,fix(i18n): correct Portuguese translations for group visibility and offers
e6e167eb,mathmartins-sb,2024-11,feat(i18n): add mass action messages for group offers in multiple locales
ffc9c96f,Odailson Silva,2024-11,TST-2133 - feat: add new informations about quantity in track-offers
d458cfc6,mathmartins-sb,2024-11,fix(i18n): update withdrawal restriction message to Spanish across multiple locales
77a725f3,mathmartins-sb,2024-11,feat(i18n): add legal withdrawal restriction message for shopping events in multiple locales
aeeae810,mathmartins-sb,2024-11,feat(i18n): add new message for shopping event withdrawal restriction
bdf8a602,Victor Grechi,2024-11,PO-2120: implementing question room page.
07e7d9e3,Carlos Henrique,2024-11,REEN: adicionado nova aba de habilitações
250234c9,larissa alves da silva,2024-11,fix: verify event-documents permission
50445114,Carlos Henrique,2024-11,REEN: adicionado serviços na tela de offertas/v2
8f056bda,Carlos Henrique,2024-11,Hotfix trying to fix v2 routes
11aded09,Carlos Henrique,2024-11,Hotfix v2 routes to stg
d8cef592,Carlos Henrique,2024-11,Hotfix v2 routes
7729f3e0,Carlos Henrique,2024-11,REEN-419: Adicionado funcionalidades nas telas de eventos v2
8a1fcec2,larissa alves da silva,2024-11,fix(BidModal): add bid on installment type and quantity items column
f6d4e04a,Victor Grechi,2024-11,feat: adding event condition to question room access button.
98390678,Joshua Maia Rodrigues,2024-10,add botton count questions room
db195477,Joshua Maia Rodrigues,2024-10,add button PublishedEventWuestionsRoomButton
e101609b,mathmartins-sb,2024-10,Refactor DateUtils to fix time zone formatting issue
1486306b,mathmartins-sb,2024-10,Update package.json to include date-fns-tz library
7eef70fd,Carlos Henrique,2024-10,Merge branch 'develop' of codecommit://sb-event-platform into REEN-383
4db84fd1,Carlos Henrique,2024-10,Feat: adicionada novas rotas v2
97dc134e,Walisson Rodrigo,2024-10,PLAT-3045 - add new field on csv example. fix uftf8 error on generate csv and open on excel
de25ce84,Carlos Henrique,2024-10,Feat: new route published auction
51ead784,mathmartins-sb,2024-10,Add support for raffle event modality in OfferSummary component
140c76ed,Carlos Henrique,2024-10,Feat: new archtecture to terminal
9dc48e72,brendaguinarte,2024-10,tst-2826
307903a5,brendaguinarte,2024-10,tst-2826
ece5c01c,Odailson Silva,2024-10,Merge branch 'develop' into TST-2521
65fe0eba,Odailson Silva,2024-10,TST-2521: feat - translations ModalOfferGroup
dbe8363f,mathmartins-sb,2024-10,Refactor event status badge margin and fix package.json
5353142c,mathmartins-sb,2024-10,Refactor event status badge margin
a4ce02ad,Odailson Silva,2024-10,revert
1925f179,Odailson Silva,2024-10,conflicts
b71978f6,Walisson Rodrigo,2024-10,PLAT-2546 - add version and fix package.json
22218bef,Walisson Rodrigo,2024-10,PLAT-2546 - add translations for error on CardOffer on cancel offer
b4841861,larissa alves da silva,2024-09,fix: adjust double download
a21bd8b1,larissa alves da silva,2024-09,fix: hidding select when is empty state
b6535acb,larissa alves da silva,2024-09,fix: adjust on downloadFile import
310d7cda,larissa alves da silva,2024-09,fix: adjust on intervalId
5d824477,larissa alves da silva,2024-09,feat: adding NPR download modal
943ac623,Martín Agüera,2024-09,feat: create timeWithTzFixed util
a54a6c28,Martín Agüera,2024-09,feat: add timeWithTzFixed to Card and OffersSummary components
9cff555d,brendaguinarte,2024-09,remove-history
bc2e2093,brendaguinarte,2024-09,label-adjustment
2e2cff0d,larissa alves da silva,2024-09,feat: add render snackbar validation
4b7538c0,larissa alves da silva,2024-09,feat: add NPR option on menu offers
4b41ccbf,Pedro Hotz Bronzato,2024-09,fix:package-json
1caf4e8b,Pedro Hotz Bronzato,2024-09,fix:modal
46744d9b,Pedro Hotz Bronzato,2024-09,fix:documents-modal-link
f9c15352,Carlos Henrique,2024-08,Feat: remove feature toogle to negotiation microfront
e27c2dde,larissa alves da silva,2024-08,fix: some adjustment in catalog modal
62171708,larissa alves da silva,2024-08,feat: fullscreen catalog modal
e887edd0,Leonardo Telles,2024-08,Merge branch 'stg' into terminal/merge_stg_into_develop
5076f593,Leonardo Telles,2024-08,Merge branch 'master' into terminal/merge_master_into_stg
82411734,Carlos Henrique,2024-08,Squashed commit of the following
aeb5c0fd,Carlos Henrique,2024-08,hotfix: added validation to offer selected
3c53db53,Martín Agüera,2024-07,refacor: add the condition in encodedFilters to send an array for many reference codes or a string for one reference code
ecc39de2,larissa alves da silva,2024-07,feat: add translation for a new column in bidding ranking table
87780cc5,Leonardo Telles,2024-07,Merge branch 'master' into terminal/merge_master_into_stg
1e8d6840,Andre Pasqualotto,2024-07,removing log and unused import
facdd222,Andre Pasqualotto,2024-07,cherrypick conflicts
6c8c89d6,Andre Pasqualotto,2024-07,Adding otherHeaders and properties to interests and winners, latam translations and general refactor of some loading and error states
c2774624,Andre Pasqualotto,2024-07,rebasing conflicts
ea4e88ef,Andre Pasqualotto,2024-06,changing placeholders and minor fixes
d46d8ed7,Andre Pasqualotto,2024-06,fixing participants query results with no users
25a2d07f,Andre Pasqualotto,2024-06,adding translations to spanish
cbd234c5,Andre Pasqualotto,2024-06,adjusting some loading states and components
0aacc663,Andre Pasqualotto,2024-06,adding button to action menu to download buying-terms and fixing loading states across components
e5531f9e,Martín Agüera,2024-07,fix: change text in FilterChildren.clear_filters key of "Filtros claros" to "Limpiar filtros"
f800b503,larissa alves da silva,2024-07,fix: passing the selected event object to catalog microfront
50b4f4c2,mathmartins-sb,2024-05,feat: Add new key/values for errors from back
61954f71,larissa alves da silva,2024-07,feat: add catalog FF
81f02245,larissa alves da silva,2024-07,fix: some adjustment
68e8ae51,larissa alves da silva,2024-07,feat: some adjustment
ca62d1bb,larissa alves da silva,2024-07,feat: add catalog btn and modal
bf9a36f9,mathmartins-sb,2024-07,refactor: Update API URLs for pre environment
4f242eed,mathmartins-sb,2024-07,refactor: Add isTypeExtraJudicialWithPostEvent flag to OfferSummary component
6dd0b59d,Andre Pasqualotto,2024-07,removing log and unused import
dec72b06,Andre Pasqualotto,2024-07,fixing conflict error
8d139ced,Andre Pasqualotto,2024-07,Adding otherHeaders and properties to interests and winners, latam translations and general refactor of some loading and error states
bdeed247,Andre Pasqualotto,2024-07,rebasing conflicts
3a20e050,Andre Pasqualotto,2024-06,changing placeholders and minor fixes
4a6ea037,Andre Pasqualotto,2024-06,fixing participants query results with no users
53f40e84,Andre Pasqualotto,2024-06,adding translations to spanish
36b2eaa9,Andre Pasqualotto,2024-06,adjusting some loading states and components
75031805,Andre Pasqualotto,2024-06,adding button to action menu to download buying-terms and fixing loading states across components
f7cae9b0,mathmartins-sb,2024-06,feat: Update OfferSummary component to use isAfterMarket flag
965f5c43,mathmartins-sb,2024-06,feat: Add isAfterMarket flag to OfferSummary and Stages components
2ca22073,Carlos Henrique,2024-06,Bugfix: Fix winner row on modal of bids
b12e534a,mathmartins-sb,2024-06,refactor: update useGenerateOffers hook to accept additional filters
05a68a85,Carlos Henrique,2024-06,Removing uncessesary comments
1a1d02dd,Carlos Henrique,2024-06,Bugfix: adjusted negotiation history date on drawer
925a82f7,Carlos Henrique,2024-06,Bugfix: fix bid modal empty
90dfe285,Philipe Schneider,2024-06,Merge branch 'stg' into equalizeBranchDevWithStg
459e611c,Philipe Schneider,2024-06,Merge branch 'master' into equalizeBranchMaster
8c24af97,Carlos Henrique,2024-06,feat: migrate negotiation tab to new microfront
4a66303e,Carlos Henrique,2024-06,Hotfix: added parameter to bid history request
d4ddbd7a,Andre Pasqualotto,2024-06,adding methods to check for endDate in event tabs
752b4748,Andre Pasqualotto,2024-06,fixing overflow and height when too much data in component
a83bd86c,Andre Pasqualotto,2024-06,fix not showing hours in event summary
9bd9e9d5,Martín Agüera,2024-06,fix: change see_details to view_details in proponentCard key of translations
245422d8,Ailson Ramos Moreira,2024-06,Merge branch 'arm-tst-1991' of codecommit://sb-event-platform into arm-tst-1991
74244278,Ailson Ramos Moreira,2024-06,change get note label to enum
09884a44,Ailson Ramos Moreira,2024-06,Merge branch 'arm-tst-1991' of codecommit://sb-event-platform into arm-tst-1991
b9f29d30,Ailson Ramos Moreira,2024-06,new label view note
3e55811b,Ailson Ramos Moreira,2024-06,new label view note
086e1e1d,Martín Agüera,2024-06,feat: add translations to menuActions of ProponentCard component
5b24bd8e,Martín Agüera,2024-06,feat: add translation to español en refusedProponentCard key
aba75a96,Carlos Henrique,2024-05,bugfix/PO-1833: adjusment on formated dates
d4433e5e,Andre Pasqualotto,2024-05,adding permission to edit/delete events buttons
3536e01a,Andre Pasqualotto,2024-05,adding event closed validation, removing inline styles and minor adjustments
771faa7e,Carlos Henrique,2024-05,Bugfix: Added error event not finished
40a21400,Andre Pasqualotto,2024-05,adding translations to interests modal
23ca578a,Carlos Henrique,2024-05,Hotfix: added element to login tag to not translate
fd47e99d,Carlos Henrique,2024-04,Bugfix(PO-1762): fix bug when negotiation offers
f6420469,Odailson Silva,2024-04,Merge branch 'develop' into MACC-1607
142f5d9c,Odailson Silva,2024-04,MACC-1607: feat: tabEnable to offers
a65acaea,Philipe Schneider,2024-04,REEN-14 - Add new key/values for errors from back
206f5ba5,Philipe Schneider,2024-04,REEN-14 - Add new key/values for errors from back
4ca2291f,Philipe Schneider,2024-04,EDG-1646 - Add error message when seller doesnt have cost center
b548ccc0,Odailson Silva,2024-04,Merge branch 'develop' into MACC-1607
72d8166e,Odailson Silva,2024-04,MACC-1607: chore: remove features event-license
9b35415a,Carlos Henrique,2024-04,Feat/PO-1784: added button to refresh negotiation offers
03a00017,Odailson Silva,2024-04,MACC-1607: chore: remove features event-license
2fee8a81,Andre Pasqualotto,2024-04,adding event closed rule to upload winners
f4cddf05,Andre Pasqualotto,2024-04,translations files
9c1d9ad5,Andre Pasqualotto,2024-04,Fixing plurals in component
e76fc65c,Andre Pasqualotto,2024-04,Fixing csv example model on winners tab
ea5c34b3,Abigail Palmero,2024-04,fix: LATAM-969
89e1c4aa,Andre Pasqualotto,2024-04,removing logs
68cabb0d,Andre Pasqualotto,2024-04,removing logs
20402acc,Andre Pasqualotto,2024-04,removing testing variables
da21c0eb,Andre Pasqualotto,2024-04,changing method to post
1f70c8b9,Andre Pasqualotto,2024-04,changing disqualify method to generic + renaming
fbe2f7aa,Andre Pasqualotto,2024-04,Adding action menu for winner, disqualify/confirm actions
8efca284,Andre Pasqualotto,2024-04,adding offer Statuses on conditional
fb468633,Andre Pasqualotto,2024-04,overwriting styles of menu components
2fb92509,Andre Pasqualotto,2024-04,adding count to i18n keys to account for plurals/singular
7da13470,Andre Pasqualotto,2024-04,adding status to enum winner raffle
477f8bd8,Andre Pasqualotto,2024-04,adding translations
f01e324d,Andre Pasqualotto,2024-04,adding checkmark icon to jsxIcons
c5006943,Gislene Carvalho,2024-04,Fix rule to disable button
12d972ee,Gislene Carvalho,2024-04,Disable button when totalBids > 0
680d3a97,Abigail Palmero,2024-04,feature: LATAM-932 & LATAM-969 added portalId to email endpoints
8444c7e0,Odailson Silva,2024-04,chore: remove toogleFeature accounts
ba6c63c1,Carlos Henrique,2024-04,feat/PO-1754: added new microfront route and featureToggle
479c34ea,Andre Pasqualotto,2024-04,Winners tab componentes, list and button
841f6dd0,Andre Pasqualotto,2024-04,Winners tab integration and app flow/modals
1871ce9b,Andre Pasqualotto,2024-04,adding api calls to service
5ef6f17e,Andre Pasqualotto,2024-04,cursor pointer on styles of image/button
065d61b3,Andre Pasqualotto,2024-04,adding position to table cell style
e4174fc6,Andre Pasqualotto,2024-04,adding prop to button styles
a9f3430c,Andre Pasqualotto,2024-04,adding translations winners tab
92546ede,Andre Pasqualotto,2024-04,renaming enum
43275dd4,Andre Pasqualotto,2024-04,Adding enum and translations
eab14fb2,Philipe Schneider,2024-04,EDG-1533 - Add eventLink on event summary when status is 1 or 13
332f9f34,Andre Pasqualotto,2024-04,adding function to component
96954a4a,mathmartins-sb,2024-03,Refactor useGetEconomicGroup to use sellerId as a parameter
95436455,mathmartins-sb,2024-03,Add useGetEconomicGroup hook and update Offers page
c1d4f33b,Andre Pasqualotto,2024-03,removing unused variable + adding proptypes to component
f43ba337,Andre Pasqualotto,2024-03,Adding snackbar to raffle context
73a442dd,Andre Pasqualotto,2024-03,adding label to component and its translations
a9e61a0e,Andre Pasqualotto,2024-03,adding eventCancelled status to components, delete method to event and translations keys
e7f6534f,Andre Pasqualotto,2024-03,adding cancelled status to enum and translations
95fd8cc0,Andre Pasqualotto,2024-03,Adding offerContext to raffle component
80984be4,rosarioconde,2024-03,add i18n on negotiation
7d0ede93,Carlos Henrique,2024-03,Hotfix: adjustment on translate
a2c0fb5e,Andre Pasqualotto,2024-03,including props in offerTab/formatting
e9416802,Andre Pasqualotto,2024-03,removing logs
2b6419a4,Andre Pasqualotto,2024-03,fixing colums/data
372f74c0,Andre Pasqualotto,2024-03,adding download interests to raffle service and tab
7bcb76bd,Andre Pasqualotto,2024-03,adding list component to interest tab + pagination methods
ef779945,Andre Pasqualotto,2024-03,fixing csv separator
70b44236,Andre Pasqualotto,2024-03,adding pagination data to API call
80360877,Andre Pasqualotto,2024-03,adding translations and fixing typo
45121112,Andre Pasqualotto,2024-03,adding valid cpfs + header fix to csv-Examples
5923e71b,Andre Pasqualotto,2024-03,removing redundant imports
0deaad6d,Andre Pasqualotto,2024-03,removing unused/redundant imports
62f791d4,Andre Pasqualotto,2024-03,Interest List Component
86c8920d,Andre Pasqualotto,2024-03,adding component and tabs
e213dd16,Andre Pasqualotto,2024-03,add i18n keys for interest list
8565ce50,Carlos Henrique,2024-03,Merge branch 'develop' of codecommit://sb-event-platform into bugfix/PO-1729
a5f7c18a,Odailson Silva,2024-03,Merge branch 'develop' into macc-1390/1391
7e01c717,rosarioconde,2024-03,add constant for the default value
acf4fdc0,rosarioconde,2024-03,refactor convertDateTimeZone
ad49f262,Maico Rodrigo Caumo,2024-03,Merge remote-tracking branch 'origin/master' into stg
d9e7cce9,Odailson Silva,2024-03,feat: rightOfPreferenceStatus and civilState
563daf1b,Carlos Henrique,2024-03,Bugfix(PO-1729): hidden negotiation button to persona seller
a6a9f47d,rosarioconde,2024-03,feat: display the negotiation date using convertDateTimeZone
21fa3825,Gislene Carvalho,2024-03,Fixing remove call getOfferPublicationList
b59eeb9b,Gislene Carvalho,2024-03,Minor adjusts on offer context
a448361a,Odailson Silva,2024-03,MACC-1426: feat - toogle feature
465a49a0,Odailson Silva,2024-03,Merge branch 'develop' into macc-1390/1391
7b046178,Odailson Silva,2024-03,MACC-1426: conection parcel sb-event-license-platform
53d5f8cc,Gislene Carvalho,2024-03,Adjusts render group offer errors
c94b9a6b,Gislene Carvalho,2024-03,Merge branch 'develop' of codecommit://sb-event-platform into feature/EDG-1423-add-new-i18n-labels
a4dcef8e,Andre Pasqualotto,2024-03,removing unused method
007969c5,Andre Pasqualotto,2024-03,adding type of document to csv examples, removing status
76620bde,Andre Pasqualotto,2024-03,removing inline css styles rebased
d340e5e8,Andre Pasqualotto,2024-03,adding event status ids to component and  constants rebased
e4c096d9,Andre Pasqualotto,2024-03,changing csv examples of winners
57d77dc1,Andre Pasqualotto,2024-03,removing unused key
f787b118,Andre Pasqualotto,2024-03,changing method names, removing duplicate method already in sb-utils
8b941779,Andre Pasqualotto,2024-03,removing unecessary ternary
80e29ecd,Andre Pasqualotto,2024-03,removing logs/adding comment to i18n file
06ee41d7,Andre Pasqualotto,2024-03,adding constantes to filetypes
4934ad27,Andre Pasqualotto,2024-03,adding file utils method to participants tab
55f85548,Andre Pasqualotto,2024-03,prop types in component companysummary
7bf2cf90,Andre Pasqualotto,2024-03,changing proptypes requirements/format
50b0e07b,Andre Pasqualotto,2024-03,adding csv enum file with data
7c45a331,Andre Pasqualotto,2024-03,adding proptypes and linter changes to componentes + csvModel in csv generator
b5da5d5f,Andre Pasqualotto,2024-03,adding proptypes and minor changes from linter
77c2c3d4,Andre Pasqualotto,2024-03,removing inline css/fixing button limits
57f1e709,Andre Pasqualotto,2024-03,removing logs
fa113765,Andre Pasqualotto,2024-03,removing logs
5595c141,Andre Pasqualotto,2024-03,changing variable name to something more clear
55bf9034,Andre Pasqualotto,2024-03,removing inline style
4023bfd0,Andre Pasqualotto,2024-03,refactoring magic expressions into methods
4cc1c461,Andre Pasqualotto,2024-03,Adding maxSize prop to upload component
f82523f4,Andre Pasqualotto,2024-03,removing inline styles from components
d56ff3dc,Andre Pasqualotto,2024-03,removing inline styles from modal title component
174de77f,Andre Pasqualotto,2024-03,adding translations i18n
1cefff1f,Andre Pasqualotto,2024-03,adding pagination and cell styles
916c2a1e,Andre Pasqualotto,2024-03,loading skeletons to participants list
7d8ad798,Andre Pasqualotto,2024-03,adding fixed table headers to participants list in i18n
e2bcd25a,Andre Pasqualotto,2024-03,refactoring participants list to allow pagination, custom table headers
82b69af7,Andre Pasqualotto,2024-03,adding tabs and changes to raffle event view
cadf0ba1,Andre Pasqualotto,2024-03,style changes to components
73d601ba,Andre Pasqualotto,2024-03,adding errors rows and generic error to result modal
fc049a2c,Andre Pasqualotto,2024-03,upload file component changes
8e2f0029,Andre Pasqualotto,2024-03,index raffle changes
90354f91,Andre Pasqualotto,2024-03,renaming component and changes to make it more generic
200a1ba6,Andre Pasqualotto,2024-03,raffle service winner methods
39c612fb,Andre Pasqualotto,2024-03,changes to model csv generator
eede063f,Andre Pasqualotto,2024-03,changing service returns
a1a42cdb,Andre Pasqualotto,2024-03,adding method to component
aa66a09b,Andre Pasqualotto,2024-03,adding backend variables to component
6a84a433,Andre Pasqualotto,2024-03,file utils to download response as csv/other file
bbf39182,Andre Pasqualotto,2024-03,adding component
e4a8b234,Andre Pasqualotto,2024-03,commenting section while data is not defined (so far these are hard coded values)
5f75cdcc,Andre Pasqualotto,2024-03,minor style changes
11352b29,Andre Pasqualotto,2024-03,Adding translations to raffle-card and event context
e905abeb,Andre Pasqualotto,2024-02,translations for raffleCard Component in group Offer
1069fe8b,Andre Pasqualotto,2024-02,todo raffle latam fix position
00f6772c,Andre Pasqualotto,2024-02,refactoring styles
2fdbb56c,Andre Pasqualotto,2024-02,Refactoring component to a more generic and reusable format
e0892323,Carlos Henrique,2024-03,Feat/PO-1689: added negotiation erros message
d7151757,Odailson Silva,2024-03,Merge branch 'develop' into macc-1390/1391
ebb5ce12,Odailson Silva,2024-03,MACC-1414: feat - rightOfPreferenceValidated
1e1b00ee,Carlos Henrique,2024-03,Bugfix: Adjusment on negotiation translate
18bd7e56,Gislene Carvalho,2024-03,Add new i18n labels
8b12e4d7,Gislene Carvalho,2024-03,Merge branch 'develop' of codecommit://sb-event-platform into add-offer-context
23a18c24,Carlos Henrique,2024-03,feat: added canceled history types on negotiation history modal
5e35d1f6,Gislene Carvalho,2024-03,Merge branch 'develop' of codecommit://sb-event-platform into add-offer-context
5f3b9748,Gislene Carvalho,2024-03,Add Offer context
362277a2,Ailson Ramos Moreira,2024-03,Merge branch 'arm-tst-1831' of codecommit://sb-event-platform into arm-tst-1831
945a91ab,Ailson Ramos Moreira,2024-03,add alert limit exceeded
a10832cd,Odailson Silva,2024-03,Merge branch 'develop' into macc-1390/1391
ce5eaebe,Ailson Ramos Moreira,2024-03,add alert limit exceeded
18f56147,Abigail Palmero,2024-03,feat: LATAM-930 Added portalId on accept-proposal requests
150aca0c,Odailson Silva,2024-03,fix: i18n
5305b5b9,Odailson Silva,2024-03,MACC-1402: data user in modal send document
1a37a375,Odailson Silva,2024-03,MACC-1390/1391: adjusts in acceptance terms flow
3b0414a2,Gislene Carvalho,2024-03,Fix apiUrl values
2b8f14fe,Gislene Carvalho,2024-03,fix i18n html close tags
17556119,Gislene Carvalho,2024-03,Merge branch 'develop' of codecommit://sb-event-platform into feature/EDG-1422-add-new-i18n-labels
2851ee67,Gislene Carvalho,2024-03,Add new i18n error group messages
6f13e2be,Gislene Carvalho,2024-03,Add error group messages to i18n files
14b0d1e3,Carlos Henrique,2024-03,Feat: added gestor login on negotiation history
821b46ea,Carlos Henrique,2024-03,feat(po-1693): added validation to show approved files
6b2b73e4,Gislene Carvalho,2024-03,Add new i18n labels
73b9f24f,Abigail Palmero,2024-02,Fixed an import
1492de51,Gislene Carvalho,2024-02,Merge branch 'develop' of codecommit://sb-event-platform into feature/EDG-1257-hidden-advanced-settings-function
9eac0a8e,Abigail Palmero,2024-02,Feature: Latam-920 added portalId to seller counterproposal
7e5b6a0e,Gislene Carvalho,2024-02,Update apiUrl.js
4ae4e1c0,Gislene Carvalho,2024-02,Merge branch 'develop' of codecommit://sb-event-platform into feature/EDG-1257-hidden-advanced-settings-function
bd6af093,Gislene Carvalho,2024-02,Update apiUrl.js
b5e6347c,Gislene Carvalho,2024-02,fix i18n labels
cf43c220,Gislene Carvalho,2024-02,Merge branch 'develop' of codecommit://sb-event-platform into feature/EDG-1422-add-new-i18n-labels
29958d72,Gislene Carvalho,2024-02,Add new i18n labels
9863ed7a,Gislene Carvalho,2024-02,Add new i18n labels
6087d069,Carlos Henrique,2024-02,Bugfix: change direct sale label of value
240a7e3e,Carlos Henrique,2024-02,bugfix: fix the issue with decimal numbers on counter propostal
10cd466a,Martín Agüera,2024-02,feat: remove condition of view CVP for all country
407b285b,Carlos Henrique,2024-02,Removing uncessesary comments
299815a0,Carlos Henrique,2024-02,hotfix: fix on pagesize, saving pagesize on query params
25c42b3d,Gislene Carvalho,2024-02,Merge branch 'develop' of codecommit://sb-event-platform into feature/EDG-1257-hidden-advanced-settings-function
2098955f,Carlos Henrique,2024-02,Merge branch 'develop' of codecommit://sb-event-platform into bugfix/PO-1672
2c527f33,Carlos Henrique,2024-02,bugfix: PO-1672 adjusted directsale value
c4973909,Odailson Silva,2024-02,feat: add modalityId in modalGroupOffer
decea3b4,Gislene Carvalho,2024-02,Merge branch 'develop' of codecommit://sb-event-platform into fix-negotiation-default-pagesize
2504bd1a,Gislene Carvalho,2024-02,Fix negotiation tab pagination view
c5878745,Odailson Silva,2024-02,wip: ajustes send-documentation e enable-user
bd12df49,Gislene Carvalho,2024-02,Hidden advanced settings button and option
c54edf28,Odailson Silva,2024-02,fix: pagination
3da7e233,Odailson Silva,2024-02,remove console
b0f35667,Odailson Silva,2024-02,fix: list preferences
aaafdd4b,Odailson Silva,2024-02,Merge branch 'develop' into feature/adjusts-event
bf5dbdaa,Odailson Silva,2024-02,feat: onSuccess sendDocument
bdbff6d2,Gislene Carvalho,2024-02,Remode duplicate i18n label
df33b3ab,Odailson Silva,2024-02,fix: preferences
804c190d,Odailson Silva,2024-02,fix: eventModalityId send S
795edeaa,Odailson Silva,2024-02,fix: getListPreferences data undefined
884dd205,Odailson Silva,2024-02,fix: translation
6b53d6e7,Odailson Silva,2024-02,refact: translation
fbdcfc72,Odailson Silva,2024-02,wip: validation sendPreferences
2925a2a8,Odailson Silva,2024-02,wip: traducao erro request
b650bbc9,Maico Rodrigo Caumo,2024-02,Merge remote-tracking branch 'origin/stg' into develop
c97a8107,Maico Rodrigo Caumo,2024-02,Merge remote-tracking branch 'origin/master' into stg
cf9ad6c0,Odailson Silva,2024-02,wip: 2 eventId
7a3702e7,Odailson Silva,2024-02,feat: urls
1af7c122,Odailson Silva,2024-02,Merge branch 'master' into fix/eventId
423a1a54,Odailson Silva,2024-02,fix: eventId in cards
668a8d06,Odailson Silva,2024-02,fix: eventId in cards
e0da27e6,Gislene Carvalho,2024-02,Merge branch 'develop' of codecommit://sb-event-platform into feature/EDG-1385-required-name-group-i18n-labels
e6191a9b,Gislene Carvalho,2024-02,Add new i18n labels
fda53de8,Odailson Silva,2024-02,Merge branch 'develop' into MACC-1247/modal-send-docs
8fcf8454,Odailson Silva,2024-02,MACC-1298: new restriction type - terms translation
b41d7df5,Gislene Carvalho,2024-02,add i18n labels
1dfc49d5,Odailson Silva,2024-02,conflicts
159a83bc,Odailson Silva,2024-02,wip: translation modal-send-documents
fa4340d4,Odailson Silva,2024-02,wip: remove oute send-document
3b03c54c,Odailson Silva,2024-02,fix: endpoint sendDocuments
348bee04,Odailson Silva,2024-02,conflicts
f81cc6aa,Odailson Silva,2024-02,conflicts
323803f2,Maico Rodrigo Caumo,2024-02,Merge remote-tracking branch 'origin/stg' into develop
794401a1,Odailson Silva,2024-02,wip: undefined
8d6c9777,Maico Rodrigo Caumo,2024-02,Merge remote-tracking branch 'origin/master' into stg
97af75e6,Odailson Silva,2024-02,wip: translation
e978fff9,Odailson Silva,2024-02,wip: translation modal-send-documents
abb556c2,Odailson Silva,2024-02,wip: remove oute send-document
